{
  "task": "BILL-9",
  "role": "reader",
  "summary": "Credit notes are created in two places: the invoicing service and a backfill script. Both write line items without the period key, so a re-rate cannot find them. Full list with locations in the findings file.",
  "attention": "complete",
  "artifacts": [
    { "path": ".agent/reads/BILL-9-credit-note-writers.md", "kind": "report", "note": "path:line — why it matters, most relevant first" }
  ],
  "decisions_needed": []
}
